<BootstrapSequence xmlns="http://arctisaurora/AuroraBootstrapTypes"
        xmlns:xsi="http://www.w3.org/2001/XMLSchema-instance"
        xsi:schemaLocation="http://arctisaurora/AuroraBootstrapTypes ../Schemas/BootstrapTypeSchema.xsd">

	<Phase Name="Bootstrap">
		<!--pre-renderer-->
		<Step Action="Settings.LoadAll"/>
		<Step Action="Logging.Configure"/>
		<Step Action="Glfw.Init"/>
		<Step Action="Profiling.Configure"/>
		<Step Action="DataManager.ParseXML"/>
		<Step Action="EntityRegistry.ParseXML"/>
		<Step Action="InputHandler.LoadInputs"/>
		<Step Action="Gradients.LoadGradients"/>
		<Step Action="Palettes.LoadPalettes"/>
		<Step Action="Effects.LoadEffects"/>
		<Step Action="AnimationLibrary.LoadAnimations"/>
		<Step Action="Engine.SystemSetup"/>
		<Step Action="Engine.InitWindowing"/>
		<Step Action="AssetRegistries.InstantiateRegistries"/>
		<Step Action="AssetRegistries.RegisterSerializableTypes"/>
		<Step Action="AssetImporter.RunImports"/>
		<!--pre-renderer-->

		<Step Action="Renderer.InitRenderer"/>
		<Step Action="Renderer.PreInitialize"/>
		<Step Action="Renderer.Initialize"/>

		<!--post-renderer-->
		<Step Action="Context.LoadContexts"/>
		<Step Action="Context.LoadDeclared"/>
		<Step Action="AssetRegistries.PrepareDefaultAssets"/>
		<Step Action="AssetRegistries.PreloadAssets"/>
		<Step Action="AssetRegistries.PrepareAllAssets"/>
		<!--post-renderer-->

		<Step Action="Renderer.SetupObjects"/>
		<Step Action="Renderer.PrepareDescriptors"/>
		<Step Action="Renderer.SetupPipelines"/>
		<Step Action="Renderer.CreateSyncObjects"/>
	</Phase>

</BootstrapSequence>
